{
  "$schema": "https://json-schema.org/draft/2020-12/schema",
  "$id": "sona://meeting-assistant/v1/transcript-response-speaker-details.schema.json",
  "title": "TranscriptResponse (speaker_details opt-in)",
  "type": "object",
  "additionalProperties": false,
  "required": [
    "meeting_id",
    "transcript_revision",
    "content_revision",
    "segments",
    "speaker_details"
  ],
  "properties": {
    "meeting_id": {
      "type": "string",
      "format": "uuid"
    },
    "transcript_revision": {
      "type": "integer",
      "minimum": 0
    },
    "content_revision": {
      "type": "integer",
      "minimum": 0
    },
    "segments": {
      "type": "array",
      "items": {
        "$ref": "#/$defs/segment"
      }
    },
    "speaker_details": {
      "const": true
    }
  },
  "$defs": {
    "segment": {
      "type": "object",
      "additionalProperties": false,
      "required": [
        "id",
        "order",
        "speaker_key",
        "speaker_name",
        "start_ms",
        "end_ms",
        "text",
        "source_epoch"
      ],
      "properties": {
        "id": {
          "type": "string",
          "format": "uuid"
        },
        "order": {
          "type": "integer",
          "minimum": 0
        },
        "speaker_key": {
          "type": "string",
          "minLength": 1
        },
        "speaker_name": {
          "type": "string",
          "minLength": 1
        },
        "start_ms": {
          "type": "integer",
          "minimum": 0
        },
        "end_ms": {
          "type": "integer",
          "minimum": 0
        },
        "text": {
          "type": "string",
          "minLength": 1
        },
        "translation": {
          "type": [
            "string",
            "null"
          ]
        },
        "detected_language": {
          "type": [
            "string",
            "null"
          ]
        },
        "source_epoch": {
          "type": "integer",
          "minimum": 0
        },
        "speaker_status": {
          "type": "string",
          "enum": [
            "unknown",
            "tentative",
            "stable"
          ]
        },
        "timing_quality": {
          "type": "string",
          "enum": [
            "aligned",
            "unavailable"
          ]
        },
        "overlap_ratio": {
          "type": [
            "number",
            "null"
          ],
          "minimum": 0,
          "maximum": 1
        },
        "speaker_manual": {
          "type": "boolean"
        }
      }
    }
  }
}
