{
  "meeting_id": "aaaaaaaa-aaaa-4aaa-8aaa-aaaaaaaaaaaa",
  "transcript_revision": 4,
  "content_revision": 4,
  "speaker_details": true,
  "segments": [
    {
      "id": "11111111-1111-4111-8111-111111111111",
      "order": 0,
      "speaker_key": "speechrail:spk-e2e-1:speaker-source:s1:spk_01",
      "speaker_name": "说话人 1",
      "start_ms": 1000,
      "end_ms": 2000,
      "text": "确认发布。",
      "translation": null,
      "detected_language": "zh",
      "source_epoch": 1,
      "speaker_status": "stable",
      "timing_quality": "aligned",
      "overlap_ratio": 0.0,
      "speaker_manual": false
    }
  ]
}
